date,abstract,keywords,doc_type,material_type,news_desk
2020-02-01,"With his signature campaign promise fulfilled, the prime minister can now reshape Britain for a generation.","['Great Britain Withdrawal from EU (Brexit)', 'Politics and Government', 'Immigration and Emigration']",article,Op-Ed,OpEd
2020-02-01,"A panel appointed by the governor acknowledged that its recommendations could not fully address what the Justice Department has called “severe, systemic” conditions.","['Prisons and Prisoners', 'Prison Guards and Corrections Officers', 'Eighth Amendment (US Constitution)', 'Politics and Government']",article,News,National
2020-02-01,"In a podcast interview on Friday, Mrs. Clinton also described the caucuses in Iowa, where Mr. Sanders leads in some polls, as “undemocratic.”","['Presidential Election of 2020', 'Presidential Election of 2016']",article,News,Politics
2020-02-01,Senators will vote on procedural motions in President Trump’s impeachment trial.,"['Trump-Ukraine Whistle-blower Complaint and Impeachment Inquiry', 'Impeachment']",multimedia,Video,
2020-02-01,"As he discussed the possibility of a White House meeting for Ukraine’s president, President Trump’s lawyer asked to save the Kyiv mayor’s job.","['Trump-Ukraine Whistle-blower Complaint and Impeachment Inquiry', 'Russian Interference in 2016 US Elections and Ties to Trump Associates', 'United States International Relations', 'Corruption (Institutional)', 'Foreign Aid', 'Impeachment', 'United States Defense and Military Forces']",article,News,Foreign
2020-02-01,"Britain exits Europe. It will be poorer, above all in its shriveled heart.","['Great Britain Withdrawal from EU (Brexit)', 'Politics and Government']",article,Op-Ed,OpEd
2020-02-01,"Christopher Paul Hasson, a self-described white nationalist, plotted to kill journalists, Democratic politicians, Supreme Court justices and those he described as “leftists in general,” prosecutors said.","['Murders, Attempted Murders and Homicides', 'Firearms', 'Terrorism', 'Drug Abuse and Traffic']",article,News,Express
2020-02-01,"Several Senate Republicans said that even if President Trump did everything impeachment managers said, he should not be removed.","['Trump-Ukraine Whistle-blower Complaint and Impeachment Inquiry', 'United States Politics and Government', 'Presidential Election of 2020']",article,News,Washington
2020-02-01,Readers react as the Republicans vote to block witnesses in President Trump’s impeachment trial.,"['Impeachment', 'United States Politics and Government']",article,Letter,Letters
2020-02-01,"On a July 25 telephone call with the president of Ukraine, President Trump described Ambassador Yovanovitch as “bad news” and said, ominously, “She’s going to go through some things.”","['Trump-Ukraine Whistle-blower Complaint and Impeachment Inquiry', 'Diplomatic Service, Embassies and Consulates']",article,News,Washington
2020-02-01,"The narrow vote came after Republican senators said they did not need to hear more evidence, and pressed toward acquitting President Trump next week.","['Impeachment', 'Presidential Election of 2020', 'Trump-Ukraine Whistle-blower Complaint and Impeachment Inquiry', 'United States Politics and Government']",article,News,Washington
2020-02-01,"In pressing toward their preordained vote of acquittal, Senate Republicans made it clear they see their fortunes and futures intertwined with the president’s.","['Impeachment', 'Presidential Election of 2020', 'United States Politics and Government']",article,News,Washington
2020-02-01,The Sanders online army resembles President Trump’s most ardent supporters in more ways than either side might care to admit.,"['Presidential Election of 2020', 'Social Media', 'United States Politics and Government']",article,Op-Ed,OpEd
2020-02-01,Many viewers don’t care about the game but watch for the commercials. Not these.,"['Surveillance of Citizens by Government', 'Chronic Traumatic Encephalopathy', 'Super Bowl', 'Football']",article,Op-Ed,OpEd
2020-02-01,"Britain has formally left the European Union, but difficult trade talks remain before the two are severed.",['Great Britain Withdrawal from EU (Brexit)'],article,Editorial,Editorial
2020-02-01,Mark Diehl is back with a suitably savage Saturday grid.,['Crossword Puzzles'],article,News,Games
2020-02-01,Republican legislators abdicated their duty by refusing to seek the truth.,"['Impeachment', 'Trump-Ukraine Whistle-blower Complaint and Impeachment Inquiry', 'Presidential Election of 2020', 'United States Politics and Government']",article,Editorial,Editorial
2020-02-01,Party leaders agreed on a schedule that would end the trial on Wednesday.,['Trump-Ukraine Whistle-blower Complaint and Impeachment Inquiry'],article,News,Washington
2020-02-01,She became a world-renowned author writing about “nice people whose lives are invaded.”,"['Deaths (Obituaries)', 'Writing and Writers', 'Books and Literature']",article,Obituary (Obit),Obits
2020-02-01,"“It’s just not right to just blanket ban a group of people,” said one college professor who has lived in the U.S. for about 20 years.","['Immigration and Emigration', 'NIGERIAN-AMERICANS', 'Executive Orders and Memorandums', 'Refugees and Displaced Persons', 'Visas', 'United States Politics and Government']",article,News,Express
2020-02-01,"On Monday, Democrats will make their choice for the Democratic presidential nominees at more than 1,600 precincts across Iowa. Here is how that will play out in one middle school gym.","['Presidential Election of 2020', 'Primaries and Caucuses']",multimedia,Interactive Feature,U.S.
2020-02-01,"Corrections that appeared in print on Saturday, Feb. 1, 2020.",[],article,Correction,Corrections
2020-02-01,"Quotation of the Day for Saturday, February 1, 2020.",[],article,Quote,Summary
2020-02-01,"Although there are few Latinos playing in the N.F.L., organizers have sought to capitalize on the region’s Latino vibe.","['Football', 'Hispanic-Americans', 'Super Bowl']",article,News,Sports
2020-02-01,"Republicans voted almost unanimously against hearing new evidence in the impeachment trial, some saying they wanted to leave President Trump’s political future in the hands of the electorate.","['Impeachment', 'United States Politics and Government', 'Trump-Ukraine Whistle-blower Complaint and Impeachment Inquiry']",article,News,Podcasts
2020-02-01,"As the first nominating contests approached, Democratic presidential candidates spent millions on ads and staff in the fourth quarter of 2019.",[],multimedia,Interactive Feature,U.S.
2020-02-01,A new Austin City Limits concert is on PBS. And a Rob Reiner classic comes to Hulu.,"['Television', 'Movies']",article,News,Culture
2020-02-01,Sowers needed an assist to get her foot in the door. Then she burst through to become the first woman to coach in the N.F.L.’s championship game.,"['Football', 'Women and Girls', 'Coaches and Managers', 'Super Bowl']",article,News,Sports
2020-02-01,"A relatively new statistic aims to quantify the likelihood of election to the Pro Football Hall of Fame. Alan Faneca should be excited, while Isaac Bruce’s wait may continue.",['Football'],article,News,Sports
2020-02-01,"Consumer confidence has rebounded since recession warnings in the summer, particularly among voters who don’t lean toward either major party.","['United States Economy', 'Presidential Election of 2020', 'Income Inequality', 'Polls and Public Opinion', 'Voting and Voters']",article,News,Business
2020-02-01,"For decades, the Little Shell tribe had no legal status. That changed in December, when Congress granted recognition to the tribe’s 5,300 members.",['Native Americans'],article,News,National
2020-02-01,"For many, it was an awkward and wrenching week of farewells. But most are racing to claim different passports, so they might keep lucrative jobs.","['Great Britain Withdrawal from EU (Brexit)', 'Passports', 'Legislatures and Parliaments']",article,News,Foreign
2020-02-01,"Philip Jacobson, who works for the environmental news organization Mongabay, was put on a plane to New York.",['Immigration Detention'],article,News,Foreign
2020-02-01,P. Carl’s memoir takes readers on the most personal journey there is.,"['Books and Literature', 'Transgender and Transsexuals']",article,Review,BookReview
2020-02-01,"“A Woman Like Her,” by Sanam Maher, investigates the killing of a 26-year-old social-media celebrity by her brother, and a culture in which independent, outspoken women are not easily tolerated.","['Books and Literature', 'Honor Killings', 'Women and Girls', 'Social Media']",article,Review,BookReview
2020-02-01,"It’s all Iowa, all the time. You may not have been there, but we were. Here’s a rundown of what happened.","['Presidential Election of 2020', 'Primaries and Caucuses']",article,News,Politics
2020-02-01,"Chris Voss details how empathy, bargaining and other tactics can be applied to landing travel perks, avoiding travel penalties and more.","['Travel and Vacations', 'AIRLINES AND AIRPLANES', 'Hotels and Travel Lodgings', 'Books and Literature']",article,News,Travel
2020-02-01,"Led by the Washington bureau, dozens of reporters, editors and other staffers are collaborating around the clock.",['Trump-Ukraine Whistle-blower Complaint and Impeachment Inquiry'],article,News,Summary
2020-02-01,"Dominic Thiem looks to unseat Novak Djokovic, and two Australian wild cards look to cap a Cinderella story.","['Tennis', 'Australian Open (Tennis)']",article,News,Sports
2020-02-01,The smoldering crater left by the apocalyptic space rock became a nice home for blue-green algae within years of the impact.,['your-feed-science'],article,News,Science
2020-02-01,"Writing “The Girl With the Louding Voice,” about a 14-year-old employed as a housemaid, challenged how the novelist viewed a common practice in her native Nigeria.","['Books and Literature', 'Women and Girls', 'Writing and Writers']",article,News,Culture
2020-02-01,"She is a forceful surrogate for Joe Biden’s campaign, in part because voters like that she has retained her own professional identity: “I admire how she’s always worked.”","['Presidential Election of 2020', 'United States Politics and Government', 'Primaries and Caucuses']",article,News,Politics
2020-02-01,"At Moda Operandi, the luxury runway website, cargo pants won’t do, unless they’re fashion approved.",['Fashion and Apparel'],article,News,Styles
2020-02-01,"With stackable plastic panels, a company called Glice wants to be rink-builder to a warming world.","['Ice', 'Ice Skating', 'Hockey, Ice']",article,News,SundayBusiness
2020-02-01,"Why are Roc Nation and the N.F.L. doing business this Super Bowl weekend? Well, social justice is expensive.","['Football', 'Super Bowl', 'Rap and Hip-Hop', 'Black People', 'Blacks', 'your-feed-longreads']",article,News,Styles
2020-02-01,"As if the caucusing wasn’t confusing enough, officials will release raw vote totals that could allow candidates to spin the results.","['Presidential Election of 2020', 'Primaries and Caucuses', 'News and News Media']",article,News,Politics
2020-02-01,"In traffic-clogged cities around the world, the skies are abuzz with helicopters.","['Helicopters', 'Commuting', 'Aviation Accidents, Safety and Disasters', 'High Net Worth Individuals', 'AIRLINES AND AIRPLANES']",article,News,Styles
2020-02-01,"American sanctions, intended to oust an authoritarian president, forced changes that have eased tensions and improved life — for some. Others see a more unequal country that has turned away from its socialist-inspired revolution.","['Economic Conditions and Trends', 'Embargoes and Sanctions', 'Income Inequality', 'Politics and Government', 'Regulation and Deregulation of Industry', 'Capitalism (Theory and Philosophy)', 'Nationalization of Industry']",article,News,Foreign
2020-02-01,"In the aftermath of hurricanes Irma and Maria, many hoteliers in the Caribbean have regrouped and rebuilt — and are ushering in a new age of hospitality.","['Travel and Vacations', 'Hotels and Travel Lodgings', 'Islands']",article,News,Travel
2020-02-01,"Kenin, an American in her first Grand Slam final, became the tournament’s youngest singles champion since Maria Sharapova in 2008.","['Australian Open (Tennis)', 'Tennis', 'Age, Chronological', 'Records and Achievements']",article,News,Sports
2020-02-01,"Hours after the morning wedding of Lauren Schneider and Lawrence Moss, the couple found themselves on very shaky ground as a 7.7 magnitude earthquake hit Jamaica.",['Weddings and Engagements'],article,News,Styles
2020-02-01,"Monique Proctor, who changed her name to DJ Smiles Davis 11 years ago, talks about playlists, fees and her favorite wedding moments.","['Music', 'Weddings and Engagements', 'Disc Jockeys']",article,News,Styles
2020-02-01,"A KFC ad in Australia that infuriated women’s groups showed the power of the #MeToo movement, even as it called back to the many sexist ads of the past.","['ADVERTISING AND MARKETING', '#MeToo Movement', 'Women and Girls', 'Discrimination', 'Social Media', 'Two Thousands (Decade)', ""Women's Rights"", 'Online Advertising']",article,News,Express
2020-02-01,"The lieutenant governor of Pennsylvania, John Fetterman, said the punishment was overly harsh and offered to personally repay the grocery store.","['Criminal Justice', 'Politics and Government', 'Amnesties, Commutations and Pardons', 'Sentences (Criminal)', 'Shoplifting and Employee Theft (Retail)']",article,News,National
2020-02-01,Joe Biden has a hold on the Democratic establishment. Much of the far left supports Bernie Sanders. Mayors are backing Pete Buttigieg and Mike Bloomberg. And then there are the celebrities.,"['Presidential Election of 2020', 'Endorsements']",article,News,Politics
2020-02-01,"With the Senate voting to bar any new witness testimony, the only outstanding question is when President Trump will be acquitted.","['Impeachment', 'Witnesses', 'Trump-Ukraine Whistle-blower Complaint and Impeachment Inquiry', 'United States Politics and Government']",article,Op-Ed,Editorial
2020-02-01,"The Lakers returned to the court for the first time since the death of Kobe Bryant and eight others in a helicopter crash, playing a game that was more reflection than sport.",['Basketball'],article,News,Sports
2020-02-01,The growing uncertainty over the safety of visiting or leaving China is bedeviling companies around the world.,"['Coronavirus (2019-nCoV)', 'Business Travel', 'Epidemics', 'AIRLINES AND AIRPLANES', 'Travel Warnings']",article,News,Business
2020-02-01,"Every month, subscription streaming services add a new batch of titles to their libraries. Here are our picks for February.","['Television', 'Movies']",article,News,Culture
2020-02-01,A conversation about how its meaning has evolved over the last two decades.,"['Music', 'Super Bowl']",article,News,Culture
2020-02-01,"Like banks, co-ops set rules about how much shareholders can borrow. But there are ways to find the equity you seek in your home.","['Real Estate and Housing (Residential)', 'Cooperatives']",article,News,RealEstate
2020-02-01,"Alison Roman’s new pasta, candied oranges, and more recipes.",[],article,News,Dining
2020-02-01,"Rights groups have condemned the plan, warning that it would increase the dangers faced by asylum seekers.","['Middle East and Africa Migrant Crisis', 'Border Barriers', 'Smuggling']",article,News,Foreign
2020-02-01,"Britain is remaking itself again. The shape of its society and economy, and its place in the world, are very much up for grabs.","['Great Britain Withdrawal from EU (Brexit)', 'Politics and Government', 'International Trade and World Market', 'Economic Conditions and Trends']",article,News,Foreign
2020-02-01,A Times investigation found widespread bullying and harassment of employees and models. The company expresses “regret.”,"['Models (Professional)', 'Lingerie and Underwear', 'Sexual Harassment', 'Women and Girls', 'Discrimination', 'Workplace Hazards and Violations']",article,News,Business
2020-02-01,The matchup between the Kansas City Chiefs and the San Francisco 49ers brings out the worst Native Americans stereotypes.,"['Football', 'Mascots', 'War Crimes, Genocide and Crimes Against Humanity', 'Airport Security', 'Native Americans', 'Indigenous People']",article,Op-Ed,OpEd
2020-02-01,"The Vermont senator has made exaggerated claims or statements that lacked context about “Medicare for all,” his antiwar record and his history of bipartisanship.","['Presidential Election of 2020', 'United States Politics and Government', 'Politics and Government']",article,News,Washington
2020-02-01,The Netflix show forced its problematic lead — and viewers — to confront the consequences of his actions.,"['Television', '#MeToo Movement', 'Sexual Harassment']",article,Op-Ed,OpEd
2020-02-01,"Every other Sunday, we complete a full orbit around Emily Cox and Henry Rathvon.",[],article,News,Games
2020-02-01,"As the slowing economy threatens Prime Minister Narendra Modi’s grip on power, the government unveiled a modest budget that one economist called “smoke and mirrors.”","['Politics and Government', 'Budgets and Budgeting', 'Economic Conditions and Trends']",article,News,Foreign
2020-02-01,Her filmography ranged from “Tarzan and the She-Devil” to “Wall Street.” She also appeared on “Batman” and on game shows and sang in cabarets.,"['Deaths (Obituaries)', 'ACTORS AND ACTRESSES', 'Movies', 'Television']",article,Obituary (Obit),Obits
2020-02-01,"Have rules limiting changes in historic districts become too restrictive and elitist, as one opinion writer suggested?","['Historic Buildings and Sites', 'Solar Energy']",article,Letter,Letters
2020-02-01,"With the Iowa caucuses set to kick off the primary season on Monday night, a Democratic race that began as a contest of ideas and ideologies has given way to a fixation on electability.","['Presidential Election of 2020', 'Primaries and Caucuses']",article,News,Politics
2020-02-01,"Chelsea bet on a beloved former player and its young talent this season, and it sits safely in fourth place. But patience will inevitably depend on results.",['Soccer'],article,News,Sports
2020-02-01,"After serving as President Jimmy Carter’s chief aide on scientific matters, he led the National Academy of Sciences for 12 years.","['Deaths (Obituaries)', 'Cold War Era', 'Science and Technology', 'United States Politics and Government']",article,Obituary (Obit),Obits
2020-02-01,"Michael R. Bloomberg, the billionaire presidential hopeful, is including more new taxes in his plan than his moderate rival Joe Biden but less than Bernie Sanders or Elizabeth Warren.","['Presidential Election of 2020', 'Federal Taxes (US)', 'Tax Cuts and Jobs Act (2017)', 'Corporate Taxes', 'Income Tax', 'Taxation']",article,News,Politics
2020-02-01,"At critical turning points, Chinese authorities put secrecy and order ahead of openly confronting the growing crisis and risking public alarm or political embarrassment.","['Coronavirus (2019-nCoV)', 'Politics and Government', 'Epidemics', 'SARS (Severe Acute Respiratory Syndrome)']",article,News,Foreign
2020-02-01,"Sandeep Mathrani will take over the operator of shared office space, which was on the brink of financial collapse last year.","['Appointments and Executive Changes', 'Real Estate (Commercial)', 'Co-Working', 'Renting and Leasing (Real Estate)']",article,News,Business
2020-02-01,President Trump’s executive order granting local officials veto power over refugee resettlement has divided communities and left immigrants feeling unwanted.,"['Executive Orders and Memorandums', 'Refugees and Displaced Persons', 'Local Government', 'Immigration and Emigration', 'Vetoes (US)', 'United States Politics and Government']",article,News,Washington
2020-02-01,American embassies appeared to sympathize with an Iranian woman who feared returning to Iran after an image of her looking like she was not wearing a hijab circulated online.,"['Chess', 'Muslim Veiling', 'United States Politics and Government', 'Muslims and Islam', 'Women and Girls']",article,News,Express
2020-02-01,"His acquittal in the Senate assured, the emboldened president will take his victory and grievance to the campaign trail, no longer worried about congressional constraint.","['Impeachment', 'Trump-Ukraine Whistle-blower Complaint and Impeachment Inquiry', 'Presidential Election of 2020', 'United States Politics and Government']",article,News,Washington
2020-02-01,And I had a serious conversation about post-Brexit trade negotiations with a man dressed as King Richard the Lionheart.,['Great Britain Withdrawal from EU (Brexit)'],article,News,OpEd
2020-02-01,Newly released emails show officials at NOAA told the agency’s scientists it did “not approve or support” a controversial agency statement issued after the president falsely said that Alabama was at risk from Hurricane Dorian.,"['Hurricane Dorian (2019)', 'Hurricanes and Tropical Storms', 'United States Politics and Government']",article,News,Climate
2020-02-01,"The diabolical duo of Donald and Mitch, serving their own interests, not the national one.","['Impeachment', 'Trump-Ukraine Whistle-blower Complaint and Impeachment Inquiry', 'United States Politics and Government', 'Presidential Election of 2020']",article,Op-Ed,OpEd
2020-02-01,"To eject the president, you need to beat him.","['Presidential Election of 2020', 'Impeachment', 'United States Politics and Government']",article,Op-Ed,Editorial
2020-02-01,This from a company that says employees should “do the right thing.”,"['Corporate Social Responsibility', 'Banking and Financial Institutions', 'Labor and Jobs']",article,Op-Ed,OpEd
2020-02-01,Countering private campaign funding with public campaign funding is the most viable way to limit the political influence of the wealthy.,"['Campaign Finance', 'Elections', 'Citizens United v Federal Election Commission (Supreme Court Decision)', 'Corruption (Institutional)', 'Presidential Election of 2020', 'United States Politics and Government', 'High Net Worth Individuals']",article,Editorial,Editorial
2020-02-01,"Win or lose in Iowa, Buttigieg has challenged and changed America.","['Presidential Election of 2020', 'Homosexuality and Bisexuality', 'Primaries and Caucuses', 'Debates (Political)', 'Same-Sex Marriage, Civil Unions and Domestic Partnerships', 'Polls and Public Opinion', 'Religion and Belief', 'Voting and Voters', 'Black People', 'Blacks']",article,Op-Ed,OpEd
2020-02-01,DeAndre Arnold was told his dreadlocks violated his Texas high school’s dress code. Now he has been invited to the Oscars by the celebrity couple Gabrielle Union and Dwyane Wade.,"['Hair', 'Black People', 'Blacks', 'Discrimination', 'Academy Awards (Oscars)', 'Movies', 'Education (K-12)']",article,News,Express
2020-02-01,The former N.B.A. guard Jason Terry last saw Kobe coaching Gianna’s Mamba Academy team a week ago. Terry and his girls’ team were supposed to face them the day of the helicopter crash.,"['Basketball', 'Aviation Accidents, Safety and Disasters', 'Women and Girls']",article,News,Sports
2020-02-01,"Inside the very weird homestretch in Iowa, where candidates were thin on the ground, but reporters were not.","['Primaries and Caucuses', 'Presidential Election of 2020', 'United States Politics and Government', 'Impeachment']",article,News Analysis,Politics
2020-02-01,"Descended from two eminent musical families, he became a maverick, questioned the establishment and fostered a career on his own terms.","['Deaths (Obituaries)', 'Classical Music']",article,Obituary (Obit),Obits
2020-02-01,"Anti-government demonstrations have been raging since October, demanding an end to political corruption.","['Politics and Government', 'Corruption (Institutional)', 'Demonstrations, Protests and Riots', 'United States Defense and Military Forces']",article,News,Foreign
2020-02-01,"The number of deaths from the virus outbreak rose to 304 and the number of cases soared to more than 14,000 as Australia and Japan joined the United States in imposing travel restrictions.","['Coronavirus (2019-nCoV)', 'Travel Warnings', 'Deaths (Fatalities)', 'International Relations']",article,News,Foreign
2020-02-01,"A sample was being sent to the federal authorities for confirmation, the city Health Department said.","['Coronavirus (2019-nCoV)', 'Viruses', 'Medicine and Health']",article,News,Metro
2020-02-01,"“You could tell by listening to Gang of Four music that punk had happened,” he once said. “But it definitely wasn’t punk music.”","['Deaths (Obituaries)', 'Pop and Rock Music']",article,Obituary (Obit),Obits
2020-02-01,Brian Herrick and Christopher Adams take us on a flight of fancy.,['Crossword Puzzles'],article,News,Games
2020-02-01,"We visited the presidential museums, libraries and sites dedicated to Andrew Johnson, Richard Nixon and Bill Clinton to talk to visitors about the impeachment facing President Trump.","['Presidents and Presidency (US)', 'United States Politics and Government', 'Trump-Ukraine Whistle-blower Complaint and Impeachment Inquiry', 'Historic Buildings and Sites', 'Libraries and Librarians']",article,News,National
2020-02-02,"Juan Guaidó, who last year declared himself Venezuela’s interim president, tried to rekindle the energy of his country’s diaspora.",['VENEZUELAN-AMERICANS'],article,News,National
2020-02-02,The specter of the divisive Democratic battles of 2016 cast a shadow over the final days of the 2020 contest for Iowa as several candidates questioned the ability of Bernie Sanders to unite the party.,"['Presidential Election of 2020', 'Primaries and Caucuses']",article,News,Politics
2020-02-02,"The groups supporting the president’s re-election bid also made 150 payments to Trump-owned entities and properties, Federal Election Commission filings show.","['Presidential Election of 2020', 'Campaign Finance', 'Political Advertising']",article,News,Washington
