date,abstract,keywords,doc_type,material_type,news_desk
2020-02-14,Planning for changes to the estate tax and the valuation discount for small businesses can be challenging. Here’s how to take advantage of them now.,"['Tax Credits, Deductions and Exemptions', 'Wills and Estates', 'Presidential Election of 2020', 'Small Business', 'Inheritance and Estate Taxes', 'Family Business', 'High Net Worth Individuals']",article,News,Business
2020-02-14,"The mother-daughter duo model layered, eclectic looks that have a carefree air — even though they took a whole team to assemble.",['Fashion and Apparel'],article,News,TStyle
2020-02-14,Friday: The news can be rough. Enjoy some tiny California love stories.,[],article,briefing,National
2020-02-14,Glimpsing the surface of a shape-shifting star.,"['Stars and Galaxies', 'Space and Astronomy']",multimedia,Interactive Feature,Science
2020-02-14,"A whipsaw week of charged decisions by the Justice Department, some favored by the president and others not, has bewildered much of Washington.",['United States Politics and Government'],article,News,Washington
2020-02-14,The actor’s new Amazon series about renegade Nazi hunters is loosely inspired by actual events but has more in common with comic books and ’70s action flicks.,['Television'],article,News,Arts&Leisure
2020-02-14,Her colossal paintings depict people of color at a scale that makes them impossible to ignore. Now nearly 40 canvases come to the New Museum.,"['Art', 'Museums']",article,News,Arts&Leisure
2020-02-14,"A crucial question for the Vermont senator has always been whether he can expand his coalition. In a race this crowded, it’s unclear whether he even needs to do so.","['Polls and Public Opinion', 'Presidential Election of 2020', 'Primaries and Caucuses']",article,News,Politics
2020-02-14,The conductor John Eliot Gardiner talks about a life listening to and performing the world’s most-played symphonies.,['Classical Music'],article,News,Arts&Leisure
2020-02-14,Russian troops are engaging in standoffs with U.S. troops guarding oil fields and fighting remnants of the Islamic State.,"['United States Defense and Military Forces', 'United States International Relations', 'Defense and Military Forces', 'Terrorism']",article,News,Washington
2020-02-14,"Check out our cool new recipe collection devoted to single-vessel cooking — just one pot, pan or skillet — and follow it up with an anchovy martini.",['Cooking and Cookbooks'],article,News,Dining
2020-02-14,The Popcast opens its mailbag in the second of two episodes devoted to our listeners.,['Pop and Rock Music'],article,News,Culture
2020-02-14,"Hear tracks by Migos, Cam, Marian Hill and others.","['Pop and Rock Music', 'Rap and Hip-Hop', 'Jazz']",article,News,Culture
2020-02-14,"Harvey Weinstein stayed in touch with women he assaulted to ensure their silence, a prosecutor said in her closing argument.","['#MeToo Movement', 'Sex Crimes', 'Sexual Harassment', 'Movies']",article,News,Metro
2020-02-14,"A new generation of builders is devising daring structures that celebrate natural materials, push for eco-consciousness — and argue for a more democratic future.","['ARCHITECTURE', 'Historic Buildings and Sites', 'Politics and Government', 'Economic Conditions and Trends', 'Building (Construction)']",article,News,TStyle
2020-02-14,"The storm’s effects were uneven: About 30 percent of the country’s coral was destroyed, but some reefs appeared to be  undamaged.","['Hurricane Dorian (2019)', 'Reefs', 'Coral', 'Environment', 'Oceans and Seas']",article,News,Climate
2020-02-14,A survey of New Zealand scientists found that recipients of a randomized funding program favored random allocations of some kinds of grant money.,"['Research', 'Lotteries', 'Science and Technology', 'Medicine and Health', 'Academic and Scientific Journals', 'Grants (Corporate and Foundation)', 'your-feed-science']",article,News,Science
2020-02-14,Caroline Baumann resigned as director of the design museum following an investigation into how she procured her wedding dress and the space for the ceremony.,"['Museums', 'Conflicts of Interest', 'Boards of Directors', 'Appointments and Executive Changes', 'Gifts to Public Officials']",article,News,Culture
2020-02-14,"Confronting a viral epidemic with a scant supply of protective equipment, more than 1,700 Chinese medical workers have already been infected, and six have died.","['Coronavirus (2019-nCoV)', 'Hospitals', 'Shortages', 'Protective Clothing and Gear', 'Masks', 'Workplace Hazards and Violations', 'Epidemics']",article,News,Foreign
2020-02-14,No winner has been declared in the Iowa Democratic caucuses. The results were so riddled with errors that we may never know what really happened.,"['Primaries and Caucuses', 'Presidential Election of 2020']",multimedia,Interactive Feature,U.S.
2020-02-14,Suspicions that the Wall Street giant sought to influence President Macron’s overhaul of the nation’s pension system have made the company a target of protesters.,"['Pensions and Retirement Plans', 'Demonstrations, Protests and Riots', 'Yellow Vests Movement', 'Organized Labor', 'Politics and Government']",article,News,Business
2020-02-14,American negotiators had insisted on a decline in hostilities — though not a complete cease-fire — before signing an agreement with the Taliban.,"['Afghanistan War (2001- )', 'United States Defense and Military Forces', 'United States International Relations', 'United States Politics and Government']",article,News,Foreign
2020-02-14,"Just when you think they’ve rebooted everything, this horror film version of a once-popular series comes along.",['Movies'],article,Review,Culture
2020-02-14,"When European competition resumes next week, Bulgaria, Romania and Cyprus all will have teams present. Russia will not.","['Soccer', 'UEFA Champions League (Soccer)']",article,News,Sports
2020-02-14,"A proposal to build two huge barriers — one that would connect Norway to Scotland, the other France to England — was described as a warning about the urgency of the climate crisis.","['Levees and Dams', 'Global Warming', 'Engineering and Engineers']",article,News,Foreign
2020-02-14,"The decision to decline charges appears to be a move to distance the Justice Department from President Trump, who has long attacked Mr. McCabe.","['Russian Interference in 2016 US Elections and Ties to Trump Associates', 'United States Politics and Government', 'Conflicts of Interest']",article,News,Washington
2020-02-14,"Politicized by her child’s death, she went on to counsel the first post-colonial leaders of Algeria, both Congos, Ivory Coast, Mali, Guinea and Ghana.","['Politics and Government', 'Women and Girls', 'Colonization', 'Biographical Information']",article,Obituary (Obit),Obits
2020-02-14,"Melissa Clark’s cheesy baked pasta requires just one skillet, and less than an hour of your time.",['Cooking and Cookbooks'],article,News,Dining
2020-02-14,The violinist Janine Jansen and the composer Tania León each made sterling contributions to this week’s program.,['Classical Music'],article,Review,Culture
2020-02-14,"Can the film’s big Oscar win change Hollywood, or will things go back to business as usual?","['Movies', 'Academy Awards (Oscars)']",article,News,Culture
2020-02-14,"The Amazon leader reached a deal for the Warner Estate in Beverly Hills with David Geffen, who has owned it since 1990.","['Real Estate and Housing (Residential)', 'High Net Worth Individuals']",article,News,Business
2020-02-14,Aravind Adiga’s novel “Amnesty” explores the ethical dilemmas of life in the shadows.,['Books and Literature'],article,Review,BookReview
2020-02-14,"Amid turmoil in the U.S. attorney’s office in Washington, the attorney general has also sent outside prosecutors to review other politically sensitive cases.","['Russian Interference in 2016 US Elections and Ties to Trump Associates', 'United States Politics and Government', 'United States Attorneys', 'Special Prosecutors (Independent Counsel)', 'Ethics and Official Misconduct']",article,News,Washington
2020-02-14,Readers discuss whether parents are intervening when they should be encouraging self-advocacy.,"['Parenting', 'Colleges and Universities']",article,Letter,Letters
2020-02-14,The civil rights lawyer Norman Siegel notes an alarming trend. Also: The prevalence of racism; New Yorkers and recycling.,"['Recycling of Waste Materials', 'Race and Ethnicity', 'Discrimination', 'Freedom of Speech and Expression']",article,Letter,Letters
2020-02-14,Here’s what’s available and how to get it using each digital assistant.,"['Computers and the Internet', 'Podcasts', 'Speakers (Audio)', 'Home Automation and Smart Homes']",article,News,Insider
2020-02-14,"To celebrate his new book, the writer Richie Jackson invited contemporary L.G.B.T.Q. voices to his home for conversation over a family-style feast.","['Parties (Social)', 'Books and Literature', 'Writing and Writers', 'Homosexuality and Bisexuality']",article,News,TStyle
2020-02-14,The club was also fined 30 million euros for “serious breaches” of European soccer’s financial regulations.,"['Soccer', 'UEFA Champions League (Soccer)', 'Regulation and Deregulation of Industry', 'Fines (Penalties)']",article,News,Sports
2020-02-14,"United, American and Southwest will substitute other planes through most of the summer travel season.","['AIRLINES AND AIRPLANES', 'Boeing 737 Max Groundings and Safety Concerns (2019)']",article,News,Business
2020-02-14,Agents from a special tactical team that normally confronts smugglers on the border are being sent to sanctuary cities across the country.,"['Illegal Immigration', 'Federal-State Relations (US)', 'Immigration and Emigration', 'Deportation', 'United States Politics and Government']",article,News,National
2020-02-14,"The public struggles of White House adviser Kellyanne Conway and her husband, George T. Conway III, are not shtick, friends say, and they are not having fun.","['United States Politics and Government', 'Impeachment', 'Presidential Election of 2020', 'Presidential Election of 2016']",article,News,Washington
2020-02-14,"After raids in six states on Friday morning, federal prosecutors arrested 12 men, one of them a police employee.","['Neo Nazi Groups', 'Hate Crimes']",article,News,Foreign
2020-02-14,Conor Dougherty’s “Golden Gates” examines the nation’s homeless problem through the battles over new development in San Francisco.,"['Books and Literature', 'Real Estate and Housing (Residential)', 'Homeless Persons', 'Land Use Policies']",article,Review,BookReview
2020-02-14,All assumptions about classical music are in question when the performance is at your apartment.,['Classical Music'],article,News,Culture
2020-02-14,A new report sent to Congress about the drone strike that killed Iran’s top general contradicted the original justification the administration provided.,"['United States Politics and Government', 'Law and Legislation', 'United States Defense and Military Forces', 'War Powers Act (1973)']",article,News,Washington
2020-02-14,Microphones and cameras lurk everywhere. You may want to slip on some privacy armor.,"['Privacy', 'Computers and the Internet', 'Speakers (Audio)', 'Facial Recognition Software', 'Home Automation and Smart Homes', 'Wearable Computing']",article,News,SundayBusiness
2020-02-14,"In a special Valentine’s Day episode, authors share their love stories in no more than 100 words.","['Love (Emotion)', 'Podcasts', ""Valentine's Day"", 'Modern Love (Times Column)']",article,News,Styles
2020-02-14,"Anne Teresa De Keersmaeker, amid “West Side Story” previews, presented an austere and captivating dance set to Bach’s cello suites.",['Dancing'],article,Review,Culture
2020-02-14,Plus: Love on top (of a mountain).,"[""Valentine's Day"", 'Love (Emotion)', 'Dating and Relationships', 'Online Dating', 'Marriages', 'Modern Love (Times Column)']",article,News,Styles
2020-02-14,"Hiring her as a typist, The New Yorker wound up publishing many of her closely observed stories, which helped redefine Irish-American literature.","['Deaths (Obituaries)', 'Writing and Writers', 'Books and Literature']",article,Obituary (Obit),Obits
2020-02-14,The Canada Letter speaks with a Times reporter who has looked into large investors who have turned away from the oil sands.,"['Greenhouse Gas Emissions', 'Oil Sands', 'Global Warming', 'Indigenous People', 'Demonstrations, Protests and Riots', 'Foreign Investments', 'Oil (Petroleum) and Gasoline']",article,News,Foreign
2020-02-14,One reader calls his objection to the president’s tweets a “Kabuki theater act feigning dismay.” Another urges the attorney general to resign.,['United States Politics and Government'],article,Letter,Letters
2020-02-14,Berkeley’s Judith Butler is the star attraction in a stimulating if overlong performance piece by her fellow academic Alexandra Chasin.,['Theater'],article,Review,Culture
2020-02-14,But what the British prime minister plans to do with his power remains something of a mystery.,"['Politics and Government', 'Legislatures and Parliaments', 'Great Britain Withdrawal from EU (Brexit)']",article,News,Foreign
2020-02-14,"The lawyer, who represented Stormy Daniels in lawsuits against President Trump, was found guilty of charges including attempted extortion and honest services fraud.",['Extortion and Blackmail'],article,News,Express
2020-02-14,"For all its modest virtues and standout performers, NYTB/Chamber Works delivers a varied program that is admirable and underwhelming.",['Dancing'],article,News,Culture
2020-02-14,"Less than a year after the original closed, Jonathan Waxman is reopening in a space nearby, with much of the old menu.","['Restaurants', 'Chefs']",article,News,Dining
2020-02-14,"In “Dark Towers,” David Enrich examines how unchecked ambition dethroned Deutsche Bank from its place at the forefront of German finance.","['Books and Literature', 'Banking and Financial Institutions']",article,Review,BookReview
2020-02-14,"In “The Professor and the Parson,” Adam Sisman recounts the life of Robert Parkin Peters: bigamist, phony academic, “Romeo of the Church.”","['Books and Literature', 'Frauds and Swindling', 'Impostors (Criminal)']",article,Review,BookReview
2020-02-14,"The red supergiant is no closer to exploding, it seems. It also no longer appears round.","['Stars and Galaxies', 'Space and Astronomy', 'Sun', 'your-feed-science']",article,News,Science
2020-02-14,"Clement Knox talks about “Seduction,” and Elisabeth Egan discusses Amina Cain’s “Indelicacy.”",['Books and Literature'],article,News,Books
2020-02-14,The C.E.O. of Left Field Labs knows the value of hiring the right people. And her employees feel it.,['ADVERTISING AND MARKETING'],multimedia,Video,
2020-02-14,Court decisions in California may shed light on how large chains make staffing decisions.,"['Elderly', 'Suits and Litigation (Civil)', 'Retirement Communities and Assisted Living', 'Elder Care', 'Elder Abuse', 'Regulation and Deregulation of Industry', 'Nursing Homes']",article,News,Science
2020-02-14,"Elected 150 years ago, Hiram Revels was the first.","['Black People', 'Blacks', 'Discrimination', 'United States Politics and Government', 'Race and Ethnicity', 'Slavery (Historical)', 'Reconstruction Era']",article,Op-Ed,OpEd
2020-02-14,A year ago we committed to work toward a goal of parity for women on the letters page. How are we doing?,"['Letters', 'Women and Girls']",article,Letter,Letters
2020-02-14,"A burning candle is regarded as a possible cause. A Pennsylvania group, which runs the orphanage, lost government accreditation several years ago.","['Orphans and Orphanages', 'Fires and Firefighters']",article,News,Foreign
2020-02-14,"Kimberly Probolus, who a year ago urged women to raise their voices and write more letters to the editor, now discusses the importance of listening.","['Women and Girls', 'Letters']",article,Letter,Letters
2020-02-14,"Luxury retail is dependent on Chinese buyers at home and abroad, and it is now facing a crisis.","['Shopping and Retail', 'Luxury Goods and Services', 'Fashion and Apparel', 'International Trade and World Market', 'Coronavirus (2019-nCoV)', 'Travel Warnings']",article,News,Business
2020-02-14,"The event, which will commemorate the lives of Bryant and his daughter, Gianna, is Feb. 24 at Staples Center in Los Angeles, with limited tickets for the public.",['Funerals and Memorials'],article,News,Sports
2020-02-14,"The New York City mayor, who was briefly a presidential candidate himself, is scheduled to campaign with Mr. Sanders in Nevada ahead of the caucuses there next week.","['Endorsements', 'Presidential Election of 2020']",article,News,Politics
2020-02-14,"Here are tips and recommendations on how to hire a C.P.A. or tax accountant near you — or further afield, if your local options are limited.","['Federal Taxes (US)', 'Property Taxes', 'Personal Finances', 'Tax Preparers and Preparation', 'Income Tax', 'ACCOUNTING AND ACCOUNTANTS', 'Taxation', 'your-feed-wirecutter']",article,News,Smarter Living
2020-02-14,"The ruling, written by a Reagan appointee, said the administration failed to show how such rules would help Medicaid to meet its mission of covering the poor.","['States (US)', 'Health Insurance and Managed Care', 'Medicaid', 'Decisions and Verdicts', 'Poverty', 'Labor and Jobs', 'Suits and Litigation (Civil)', 'United States Politics and Government']",article,News,Science
2020-02-14,"Jean-Luc takes a detour to see some old friends, and comes across an unexpected one.",['Television'],article,Review,Culture
2020-02-14,"While seeking to reconcile science and religion, Father Coyne also vigorously supported Darwin and challenged believers in intelligent design.","['Deaths (Obituaries)', 'Space and Astronomy', 'Evolution (Biology)', 'Telescopes and Observatories']",article,Obituary (Obit),Obits
2020-02-14,"From Goldman Sachs to Amazon to the Democratic contenders, older rich men are going wild online.","['Social Media', 'United States Politics and Government', 'Presidential Election of 2020', 'Whites', 'Men and Boys', 'High Net Worth Individuals', 'your-feed-internet-culture', 'your-feed-selfcare']",article,News,Styles
2020-02-14,The Government Accountability Office will review how the $28 billion farm bailout aimed at cushioning trade-related losses was spent.,"['Agriculture and Farming', 'Crop Controls and Subsidies', 'Federal Aid (US)', 'Customs (Tariff)', 'International Trade and World Market', 'United States Politics and Government']",article,News,Washington
2020-02-14,Our interview with the woman defending Harvey Weinstein.,"['Podcasts', 'Newsletters']",article,News,Podcasts
2020-02-14,The stricter policy requires all residents who are returning from outside the city to isolate themselves for 14 days.,"['Coronavirus (2019-nCoV)', 'Quarantines']",article,News,Foreign
2020-02-14,"Bryant was expected to take the step toward the hall even before he died in a helicopter crash in January. Tim Duncan, Kevin Garnett and Tamika Catchings are also on the ballot.","['Basketball', 'Halls of Fame']",article,News,Sports
2020-02-14,Bernie Sanders and Elizabeth Warren probably both can’t squeeze through.,"['Presidential Election of 2020', 'Primaries and Caucuses', 'Liberalism (US Politics)']",article,Op-Ed,Editorial
2020-02-14,Here’s what you need to know at the end of the day.,[],article,briefing,NYTNow
2020-02-14,The police used an antiterror law to demand information about who leaked crime scene photos that she posted to social media.,"['Police', 'News Sources, Confidential Status of', 'News and News Media', 'Subpoenas', 'Social Media', 'USA PATRIOT Act', 'Freedom of the Press']",article,News,Metro
2020-02-14,Suspicions that Chuckie O’Brien was involved in the union boss’s disappearance trailed him for 45 years.,"['Deaths (Obituaries)', 'Organized Crime', 'Organized Labor', 'Movies']",article,Obituary (Obit),Obits
2020-02-14,A child development specialist is accused of trying to overthrow the government. He says his arrest was an accident.,"['Politics and Government', 'Demonstrations, Protests and Riots', 'Human Rights and Human Rights Violations', 'Prisons and Prisoners', 'Education (K-12)']",article,News,Foreign
2020-02-14,"Sharing the prize with Al Gore, his U.N. organization was recognized for its work on global warming, but his career was undone by harassment accusations.","['Deaths (Obituaries)', 'United Nations Framework Convention on Climate Change', 'Science and Technology', 'Global Warming']",article,Obituary (Obit),Obits
2020-02-14,"After a breakout 2018 season, Andujar spent nearly all of last season injured. He’s healthy enough to return, but there’s one problem: Someone took his spot.","['Baseball', 'Sports Injuries']",article,News,Sports
2020-02-15,Readers share tips for avoiding the pitfalls of gender stereotypes in relationships.,"['Marriages', 'Dating and Relationships', 'Same-Sex Marriage, Civil Unions and Domestic Partnerships', 'Parenting']",article,Op-Ed,OpEd
2020-02-15,The battle for momentum in the two states could prove pivotal. Here’s how the candidates are making their pitches.,"['Primaries and Caucuses', 'Presidential Election of 2020', 'Political Advertising', 'Campaign Finance', 'Spanish Language']",article,News,Politics
2020-02-15,"Unlike campaign advertisements, the posts are not subject to advance review by Facebook, and the platform does not make money from them.","['Social Media', 'Online Advertising', 'Political Advertising', 'your-feed-internet-culture', 'Presidential Election of 2020']",article,News,Styles
2020-02-15,"If Andy King is found guilty, the Council speaker said that city lawmakers “should move to expel him.”","['Ethics and Official Misconduct', 'City Councils', 'Politics and Government']",article,News,Metro
2020-02-15,"Kathie Klages, a former gymnastics coach at Michigan State University, could face up to four years in prison after being found guilty of lying to two investigators.","['Athletics and Sports', 'Colleges and Universities', 'Sex Crimes', 'Women and Girls', 'Suits and Litigation (Civil)']",article,News,Express
2020-02-15,The Trump administration announced it would increase tariffs on European aircraft in an effort to ramp up pressure in a long-running airplane subsidy dispute.,"['International Trade and World Market', 'AIRLINES AND AIRPLANES', 'Customs (Tariff)', 'United States Politics and Government', 'Wines']",article,News,Washington
2020-02-15,"Amid mounting furor over politicization at the Justice Department, the attorney general ordered reviews of such investigations and prosecutions.","['United States Attorneys', 'Special Prosecutors (Independent Counsel)', 'Russian Interference in 2016 US Elections and Ties to Trump Associates', 'United States Politics and Government']",article,News,Washington
2020-02-15,"The husband and wife, both in their 60s, were confirmed to have the virus after returning home to Japan. Officials in Hawaii were racing to find people they may have met in the state.",['Coronavirus (2019-nCoV)'],article,News,National
2020-02-15,What happens when the left cedes the free speech high ground?,"['#MeToo Movement', 'United States Politics and Government']",article,Op-Ed,OpEd
2020-02-15,"A Manhattan investigation had led to charges against Etienne Uzac, who co-owned IBT Media, and another media executive.","['Magazines', 'Frauds and Swindling', 'Money Laundering']",article,News,Business
2020-02-15,"To keep a promise as he runs for re-election, Trump uses more military funds to pay for the border wall.","['Illegal Immigration', 'Border Barriers', 'Drug Abuse and Traffic', 'Federal Budget (US)', 'Presidential Election of 2020', 'United States Politics and Government']",article,Editorial,Editorial
2020-02-15,Mayor Michael B. Hancock said he would veto a measure passed by the City Council that would have repealed the city’s 30-year ban on pit bulls.,"['Dogs', 'Animal Abuse, Rights and Welfare', 'Politics and Government', 'Law and Legislation', 'City Councils']",article,News,Express
2020-02-15,Randolph Ross presents a capital puzzle on a celebratory day.,['Crossword Puzzles'],article,News,Games
2020-02-15,A judge has ordered that the city revoke the building permit for 200 Amsterdam Avenue.,"['Real Estate and Housing (Residential)', 'Condominiums', 'Buildings (Structures)']",article,News,Express
2020-02-15,"Quotation of the Day for Saturday, February 15, 2020.",[],article,News,Summary
2020-02-15,"Corrections that appeared in print on Saturday, Feb. 15, 2020.",[],article,News,Corrections
2020-02-15,Passengers and crew members quarantined off Japan were told by the American Embassy that a chartered flight would arrive on Sunday to take them back to the United States.,"['Coronavirus (2019-nCoV)', 'Quarantines', 'Epidemics']",article,News,Foreign
2020-02-15,A new romantic comedy debuts on Freeform. And the childhood story of a girl and her dog comes to Disney Plus.,"['Television', 'Movies']",article,News,Culture
2020-02-15,"In China, after assurances that people should go back to work, officials partly changed course and announced mandatory quarantine for people returning to Beijing.","['Coronavirus (2019-nCoV)', 'Cruises']",article,News,Foreign
2020-02-15,"Suspended from the Champions League for two seasons, a team declares it will clear its name. But City, and European soccer’s governing body, both know the stakes are much bigger than that.","['Soccer', 'UEFA Champions League (Soccer)']",article,News,Sports
2020-02-15,"As test scores lag, there’s a growing debate between proponents of the “science of reading,” which emphasizes phonics, and traditional educators who prefer to instill a love of literature.","['Reading and Writing Skills (Education)', 'Education (K-12)', 'Teachers and School Employees', 'Tutors and Tutoring']",article,News,National
