date,abstract,keywords,doc_type,material_type,news_desk
2020-02-07,"The club said The Sun had prior knowledge of a vandalism incident, and the Premier League vowed to punish abusive fans with leaguewide bans.",['Soccer'],article,News,Sports
2020-02-07,"Privately, Chinese doctors say they need outside expertise. But Beijing, without saying why, has shown no interest so far.","['Coronavirus (2019-nCoV)', 'SARS (Severe Acute Respiratory Syndrome)', 'United States International Relations']",article,News,Science
2020-02-07,"In a wide-ranging career, he appeared onstage, on TV and in films and was the voice of Mark Twain for a Ken Burns film and of an “Outer Limits” reboot.","['Deaths (Obituaries)', 'ACTORS AND ACTRESSES', 'Television', 'Movies']",article,Obituary (Obit),Obits
2020-02-07,"Resources are already stretched during flu season. With so much medical equipment and drugs made in China, public health experts are anxiously watching the global supply chain.","['Shortages', 'Hospitals', 'Coronavirus (2019-nCoV)', 'Drugs (Pharmaceuticals)', 'Epidemics', 'Disasters and Emergencies', 'Influenza', 'your-feed-healthcare']",article,News,Science
2020-02-08,"In the final edition of our impeachment newsletter, a survey of the trial’s impact on American politics.","['United States Politics and Government', 'Trump-Ukraine Whistle-blower Complaint and Impeachment Inquiry']",article,News,Washington
2020-02-08,"Mr. Velásquez, who boasted of murdering hundreds of people for Pablo Escobar, in recent years had built a business around the memories of his criminal activities.","['Deaths (Obituaries)', 'Drug Cartels', 'Murders, Attempted Murders and Homicides', 'Drug Abuse and Traffic']",article,Obituary (Obit),Obits
2020-02-08,"A highly contagious patient, virus transmission inside a hospital and unexpected turns for the worse have emerged as part of the epidemic in China.","['Coronavirus (2019-nCoV)', 'Epidemics', 'Hospitals', 'SARS (Severe Acute Respiratory Syndrome)', 'MERS (Middle East Respiratory Syndrome)', 'Viruses', 'your-feed-healthcare']",article,News,Science
2020-02-08,"With his impeachment vote, Mitt Romney vindicates an American ideal.","['Impeachment', 'United States Politics and Government']",article,Op-Ed,OpEd
2020-02-08,Congressional hearings are urgently needed to address location tracking.,"['Surveillance of Citizens by Government', 'Data-Mining and Database Marketing', 'Illegal Immigration', 'Privacy', 'Computers and the Internet', 'Facial Recognition Software', 'United States Politics and Government', 'ADVERTISING AND MARKETING', 'Smartphones', 'Search and Seizure']",article,Op-Ed,Editorial
2020-02-08,"Here is how our reporters covered the Feb. 7 debate in real time from New Hampshire, four days before the primary.","['Debates (Political)', 'Presidential Election of 2020']",multimedia,Interactive Feature,U.S.
2020-02-08,See the looks from the Monse: Fall 2020 Collection.,['New York Fashion Week'],multimedia,Slideshow,Fashion & Style
2020-02-08,Senator Bernie Sanders and former Vice President Joseph R. Biden Jr. led the stage of seven candidates.Follow along live during the debate.,"['Presidential Election of 2020', 'Debates (Political)', 'Politics and Government', 'Elections']",multimedia,Interactive Feature,U.S.
2020-02-08,The design museum did not say why Caroline Baumann stepped down. The Smithsonian provost will serve as interim director during the search for her replacement.,"['Appointments and Executive Changes', 'Museums']",article,News,National
2020-02-08,"At two events during Oscar week, these stars spoke candidly about an awards season that sometimes excludes them.","['Black People', 'Blacks', 'ACTORS AND ACTRESSES', 'Academy Awards (Oscars)', 'Movies']",article,News,Culture
2020-02-08,A collection of comments from the latest recipient of the Presidential Medal of Freedom.,['Presidential Medal of Freedom'],article,Op-Ed,OpEd
2020-02-08,Democrats were off to a fiery start in the New Hampshire presidential primary debate on Friday.,"['Presidential Election of 2020', 'Debates (Political)']",article,News,Politics
2020-02-08,The president promoted the economy and “opportunity zones” and questioned African-American support for Democrats.,"['Tax Cuts and Jobs Act (2017)', 'Presidential Election of 2020', 'State of the Union Message (US)']",article,News,Washington
2020-02-08,"In the most contentious debate so far, Joseph R. Biden Jr. challenged Bernie Sanders over gun regulation, and Amy Klobuchar accused Pete Buttigieg of presenting himself as a “cool newcomer.”","['Presidential Election of 2020', 'Debates (Political)', 'Primaries and Caucuses']",article,News,Politics
2020-02-08,"Hemant Mehta, noob, makes a modern debut today.",['Crossword Puzzles'],article,News,Games
2020-02-08,"Alec McKinney, one of two students charged in the attack, told the authorities he had targeted people who had taunted him for being transgender.","['School Shootings and Armed Attacks', 'Murders, Attempted Murders and Homicides']",article,News,Express
2020-02-08,"The Americans, the reigning World Cup champions, will look to claim their fifth Olympic crown at the Tokyo Games this summer.","['Soccer', 'Olympic Games (2020)']",article,News,Sports
2020-02-08,Mr. Biden faulted Mr. Sanders for voting in favor of a 2005 bill to shield gun manufacturers from liability lawsuits. Mr. Biden said that the “first thing I’ll do as president is work to get rid of that.”,"['Presidential Election of 2020', 'Debates (Political)', 'Gun Control']",article,News,Politics
2020-02-08,"The candidates had their most significant discussion about abortion in any debate yet, tackling an issue whose absence from previous debates has angered advocates.","['Presidential Election of 2020', 'Debates (Political)', 'ABORTION', 'Roe v Wade (Supreme Court Decision)', 'Appointments and Executive Changes']",article,News,Politics
2020-02-08,"Corrections that appeared in print on Saturday, Feb. 8, 2020.",[],article,Correction,Corrections
2020-02-08,"Quotation of the Day for Saturday, February 8, 2020.",[],article,Quote,Summary
2020-02-08,The 15th Amendment had a major flaw.,"['Voter Registration and Requirements', 'Constitutional Amendments', 'Black People', 'Blacks', 'Race and Ethnicity', 'Politics and Government']",article,Op-Ed,Editorial
2020-02-08,"In New Hampshire, the Democratic field defines itself, unflatteringly, as “cool newcomer” vs. “establishment experience.”","['Presidential Election of 2020', 'Primaries and Caucuses', 'United States Politics and Government', 'Debates (Political)']",article,News Analysis,Politics
2020-02-08,"The number of confirmed infections rose to 37,198, most of them in Hubei Province, Chinese officials said on Sunday.",['Coronavirus (2019-nCoV)'],article,News,Foreign
2020-02-08,"Seven presidential candidates faced off in New Hampshire, days before the Democratic primary.","['Debates (Political)', 'Primaries and Caucuses']",multimedia,Video,
2020-02-08,A new psychological thriller is available on Netflix. And an Octavia Spencer horror film is on HBO.,"['Television', 'Movies']",article,News,Culture
2020-02-08,Our columnists and contributors give their rankings.,['Debates (Political)'],multimedia,Interactive Feature,Opinion
2020-02-08,The United States has no plans to conduct additional evacuations from China though some Americans are asking for help.,"['Coronavirus (2019-nCoV)', 'Epidemics', 'Deaths (Fatalities)', 'Viruses', 'Evacuations and Evacuees', 'United States International Relations']",article,News,Foreign
2020-02-08,"Daenan Gyimah, who plays for the U.C.L.A. Bruins, is also a rising hip-hop artist.","['Volleyball', 'Rap and Hip-Hop']",article,News,Styles
2020-02-08,It was a remarkably busy week on the 2020 campaign trail. Here’s a cheat sheet.,"['Presidential Election of 2020', 'Primaries and Caucuses', 'United States Politics and Government']",article,News,Politics
2020-02-08,"Take it from Jasmine Brand, who started the celebrity news site The Jasmine Brand 10 years ago, and is still going strong.","['Celebrities', 'Blogs and Blogging (Internet)']",article,News,Styles
2020-02-08,17 African countries declared independence in 1960. Archival photographs capture the mood of the period 60 years later.,['Photography'],article,News,Weekend
2020-02-08,"In this week’s column, Sarah Firshein investigates those pesky resort fees — and ways to perhaps get out of them.","['Travel and Vacations', 'Prices (Fares, Fees and Rates)', 'Hotels and Travel Lodgings', 'Attorneys General', 'Consumer Protection']",article,News,Travel
2020-02-08,"As a horse’s hoof forms, scientists say something profound is occurring in its anatomical development.","['Horses', 'Feet', 'Evolution (Biology)', 'ANATOMY AND PHYSIOLOGY', 'your-feed-science']",article,News,Science
2020-02-08,"The New Beverly Cinema, owned by Quentin Tarantino, is riding a boom in art house theaters.","['Movies', 'Theaters (Buildings)']",article,News,Styles
2020-02-08,"Neymar went to Paris to step out of Lionel Messi’s shadow, to live up to his billing as soccer’s next best thing. Nearly three years on, the move has been a comprehensive failure.",['Soccer'],article,News,Sports
2020-02-08,"Ask Republicans in the state what they think of Mr. Sessions, who is running again for the Senate there, and many will use the same belittling adjectives the president has hurled at him.","['Elections, Senate', 'Russian Interference in 2016 US Elections and Ties to Trump Associates', 'Voting and Voters', 'Conservatism (US Politics)', 'United States Politics and Government']",article,News,Politics
2020-02-08,Eight passengers and a pilot were on the S-76B helicopter that crashed on a foggy hillside in the Santa Monica Mountains. This is the story of what happened.,"['Helicopters', 'Aviation Accidents, Safety and Disasters', 'Basketball', 'Deaths (Fatalities)']",article,News,National
2020-02-08,"New evidence suggests a 17th-century work, on view for years at the Metropolitan Museum of Art, was once owned by a Jewish art dealer who fled the Nazis.","['Arts and Antiquities Looting', 'Holocaust and the Nazi Era', 'Museums']",article,News,Culture
2020-02-08,Julie Zhong counts herself lucky. There has been little disruption to her life. But she’s angry about the prejudice she says people from her city are facing.,"['Coronavirus (2019-nCoV)', 'Epidemics']",article,News,Foreign
2020-02-08,"Rolake Bamgbose and Justice Whitaker, both filmmakers, met through a dating app. Their first date was at a coffee shop.",['Weddings and Engagements'],article,News,Styles
2020-02-08,Long tangents. Short bursts of action. Cameos. And a lot of tedious watching.,"['Baseball', 'Movies']",article,News,Sports
2020-02-08,"After finding success on television and Broadway, he established a progressive school and later wandered around America as a late-blooming hippie.","['Deaths (Obituaries)', 'ACTORS AND ACTRESSES', 'Movies', 'Television', 'Theater', 'Comedy and Humor']",article,Obituary (Obit),Culture
2020-02-08,Feeling lucky? Two of the big race lotteries — actually drawings used to decide who gets to run in a race — are open right now.,"['Running', 'New York City Marathon', 'Chicago Marathon', 'Boston Marathon']",article,News,Well
2020-02-08,"The soldier shot a superior officer at a military base, then went on a shooting rampage at a mall before he died in the standoff with soldiers and the police, officials said.","['Korat, Thailand, Shooting (2020)', 'Mass Shootings', 'Military Bases and Installations', 'Shopping Centers and Malls', 'Defense and Military Forces']",article,News,Foreign
2020-02-08,"Faced with a severe economic crisis, the country’s leader, Nicolás Maduro, is letting foreign firms take over daily operations of its oil fields. It’s a break with core tenets of his socialist revolution.","['Politics and Government', 'Economic Conditions and Trends', 'Privatization', 'Nationalization of Industry', 'Oil (Petroleum) and Gasoline', 'Embargoes and Sanctions']",article,News,Foreign
2020-02-08,A roundup of the Twitter reaction after seven candidates faced off Friday in New Hampshire.,"['Presidential Election of 2020', 'Primaries and Caucuses']",article,News,Politics
2020-02-08,"Voters in the populous, heavily Republican suburbs west of Milwaukee did not entirely embrace Donald Trump in 2016. They do now.","['Impeachment', 'Polls and Public Opinion', 'Presidential Election of 2020', 'Trump-Ukraine Whistle-blower Complaint and Impeachment Inquiry', 'Presidential Election of 2016']",article,News,National
2020-02-08,Everyone is entitled to live in a space where they feel comfortable. But they also shouldn’t have to feel pressured to do chores they don’t want to do.,"['Real Estate and Housing (Residential)', 'Renting and Leasing (Real Estate)']",article,News,RealEstate
2020-02-08,"Though their shutout from the directing nominations made headlines, female filmmakers dominate the documentary categories. And a female composer may win best score.",['Academy Awards (Oscars)'],article,News,Culture
2020-02-08,"Chocolate caramel tart, blender chocolate mousse, and more recipes.",[],article,News,Dining
2020-02-08,"Andrew J. Ries has a few new experiments, and we are his subjects.",['Crossword Puzzles'],article,News,Games
2020-02-08,See the looks from the Tom Ford: Fall 2020 Collection.,['New York Fashion Week'],multimedia,Slideshow,Fashion & Style
2020-02-08,An investigation into the Confederation of African Football uncovered information suggesting that tens of millions of dollars had been misappropriated.,"['Soccer', 'Ethics and Official Misconduct', 'Corruption (Institutional)']",article,News,Sports
2020-02-08,Didier Gailhaguet stepped down after allegations of rape and sexual harassment against underage figure skaters by their coaches while he was in charge of the federation.,"['Figure Skating', 'Sex Crimes', 'Child Abuse and Neglect', 'Sexual Harassment', 'Coaches and Managers', 'Athletics and Sports', 'Appointments and Executive Changes']",article,News,Foreign
2020-02-08,"World War I was a disaster, but Sam Mendes’s Oscar-nominated epic paints a dangerously misleading picture of the conflict.","['World War I (1914-18)', 'Defense and Military Forces', 'Movies']",article,Op-Ed,OpEd
2020-02-08,"It has been a long time since the winter of 1920, but the old fault lines are still visible.","['Nineteen Hundred Twenties', 'Presidents and Presidency (US)', 'Radio', 'United States Politics and Government']",article,Op-Ed,OpEd
2020-02-08,"My family has no idea where our next check will come from, because of a radical change in rent laws, enacted out of the blue.","['Real Estate Brokers', 'Landlords', 'Renting and Leasing (Real Estate)', 'Prices (Fares, Fees and Rates)']",article,Op-Ed,OpEd
2020-02-08,The irrational comforts of a panic-shopping spree.,"['SARS (Severe Acute Respiratory Syndrome)', 'Coronavirus (2019-nCoV)', 'Masks', 'Hygiene and Cleanliness', 'Supermarkets and Grocery Stores', 'Cleansers, Detergents and Soaps', 'Influenza']",article,Op-Ed,OpEd
2020-02-08,"Xi Jinping has backed out of the spotlight as the country faces its worst crisis in years, reflecting the political risks he faces if efforts to contain the virus fail.","['Politics and Government', 'Coronavirus (2019-nCoV)', 'Epidemics', 'Censorship', 'Propaganda']",article,News,Foreign
2020-02-08,"He was one of the last of “The Few,” the Royal Air Force airmen who defended Britain against the powerful Luftwaffe.","['Deaths (Obituaries)', 'World War II (1939-45)', 'Defense and Military Forces', 'Pilots']",article,Obituary (Obit),Obits
2020-02-08,"After watching the disaster in Iowa, Nevada party officials are scrambling to find other ways to count and report results later this month.",['Primaries and Caucuses'],article,News,Politics
2020-02-08,Readers react to an article comparing textbooks in California and Texas.,"['Textbooks', 'History (Academic Subject)', 'Education (K-12)', 'Politics and Government']",article,Letter,Letters
2020-02-08,"With impeachment behind the president, his re-election campaign wants to address political weaknesses exacerbated by his policies and behavior.","['Presidential Election of 2020', 'United States Politics and Government', 'Black People', 'Blacks', 'Suburbs']",article,News,Politics
2020-02-08,"A weak showing in New Hampshire, some Democrats warn, could undermine his electability argument and accelerate a flight of donors and voters to his rivals.","['Presidential Election of 2020', 'Primaries and Caucuses', 'Campaign Finance', 'United States Politics and Government']",article,News,Politics
2020-02-08,"During a lull in terrorist attacks, Kabul residents are talking about how rampant crime has become. A long-militarized police force is finding it difficult to regear.","['Afghanistan War (2001- )', 'Crime and Criminals', 'Murders, Attempted Murders and Homicides', 'Attacks on Police', 'Terrorism', 'Police']",article,News,Foreign
2020-02-08,Lin-Manuel Miranda and Spike Lee are among the artists who will pair with a protégé in the program.,['Culture (Arts)'],article,News,Culture
2020-02-08,An enraged and ebullient Trump ups the body count.,"['Impeachment', 'United States Politics and Government', 'Primaries and Caucuses', 'Presidential Election of 2020']",article,Op-Ed,OpEd
2020-02-08,"The economy may get the president re-elected, but not everyone is sharing in its strength.","['Income Inequality', 'United States Economy', 'Presidential Election of 2020', 'United States Politics and Government']",article,Op-Ed,OpEd
2020-02-08,What better foe for the president than his alter ego?,"['Primaries and Caucuses', 'Presidential Election of 2020', 'United States Politics and Government']",article,Op-Ed,OpEd
2020-02-08,"“This is the foreshadowing of what is to come,” a researcher said. “It’s exactly in line of what we’ve been seeing for decades.”","['Temperature', 'Ice', 'Global Warming', 'Greenhouse Gas Emissions']",article,News,Express
2020-02-08,"Six American service members were wounded, a spokesman for the U.S. military said. He said a person in an Afghan uniform appeared to have opened fire.","['United States Defense and Military Forces', 'Afghanistan War (2001- )', 'Defense and Military Forces', 'Deaths (Fatalities)']",article,News,Foreign
2020-02-08,"A handful of senators reached out to the White House to warn the president not to dismiss Gordon D. Sondland, the ambassador to the European Union who testified in the House hearings. But Mr. Trump went ahead anyway.","['Impeachment', 'Trump-Ukraine Whistle-blower Complaint and Impeachment Inquiry', 'United States International Relations', 'United States Politics and Government', 'Diplomatic Service, Embassies and Consulates']",article,News,Washington
2020-02-08,"Brian Kulman, a new constructor, brings us a series of cinematic ciphers.",['Crossword Puzzles'],article,News,Games
2020-02-08,"The Trump administration has reshaped the courts through conservative judicial appointments. In a candidate forum, Democrats described how they would respond.","['Presidential Election of 2020', 'Courts and the Judiciary', 'Elections, Senate']",article,News,Politics
2020-02-08,"Our daily recaps and the most memorable moments from the runways, as captured by T’s photographers.","['New York Fashion Week', 'Fashion and Apparel', 'Fashion Shows']",article,News,TStyle
2020-02-08,The party formerly linked to the Irish Republican Army is expected to get an equal share of votes to Prime Minister Leo Varadkar’s party and the main opposition group.,['Legislatures and Parliaments'],article,News,Foreign
2020-02-09,"The former vice president and his campaign, under pressure after his poor performance in Iowa, mounted unusually personal attacks on Mr. Buttigieg ahead of the New Hampshire primary.","['Presidential Election of 2020', 'Primaries and Caucuses', 'United States Politics and Government']",article,News,Politics
2020-02-09,"Duplantis of Louisiana is the world’s best pole-vaulter, but he will represent Sweden instead of the United States at the Olympics.","['Track and Field', 'Records and Achievements', 'Pole Vault']",article,News,Sports
2020-02-09,"“He was going to lead them outside, and when he got to the door and outside, the children were not with him,” the fire chief said of the children’s father.","['Fires and Firefighters', 'Deaths (Fatalities)']",article,News,Express
2020-02-09,Elizabeth Warren would have liked more speaking time at the debate. Amy Klobuchar said she had a home-field advantage at an ice arena. Both spent the day after making the case that they’re the ones to defeat President Trump.,"['Presidential Election of 2020', 'Debates (Political)']",article,News,Politics
2020-02-09,A heated Democratic debate on Friday set the stage for a fierce day on the campaign trail in New Hampshire on Saturday.,[],multimedia,Interactive Feature,U.S.
2020-02-09,The video was edited to appear as if Speaker Nancy Pelosi were ripping a copy of President Trump’s State of the Union address while he honored a Tuskegee airman and military families.,"['Social Media', 'Presidential Election of 2020', 'Political Advertising', 'Video Recordings, Downloads and Streaming', 'United States Politics and Government', 'State of the Union Message (US)']",article,News,Express
2020-02-09,See the looks from the Brandon Maxwell: Fall 2020 Collection.,['New York Fashion Week'],multimedia,Slideshow,Fashion & Style
2020-02-09,"The police commissioner called the Bronx rampage an “assassination attempt,” and a backlash grew over anti-police protests.","['Attacks on Police', 'Murders, Attempted Murders and Homicides']",article,News,Metro
2020-02-09,"Mr. Conrad, known for tough guy roles, played a secret agent in a mid-1960s television series that transplanted James Bond-style plots into an Old West setting.","['Deaths (Obituaries)', 'Television', 'ACTORS AND ACTRESSES']",article,Obituary (Obit),Obits
2020-02-09,"Corrections that appeared in print on Sunday, Feb. 9, 2020.",[],article,Correction,Corrections
2020-02-09,"Quotation of the Day for Sunday, February 9, 2020.",[],article,News,Summary
2020-02-09,See the looks from the Laquan Smith: Fall 2020 Collection.,['New York Fashion Week'],multimedia,Slideshow,Fashion & Style
2020-02-09,"More than 900 people have died from the new virus in China. The 2002-3 epidemic, which also began in the country, killed 774 people worldwide.","['Coronavirus (2019-nCoV)', 'Epidemics']",article,News,Foreign
2020-02-09,"The bride, a clinical pharmacist, and the groom, the director of baseball operations for the L.A. Dodgers, were married in San Diego.",['Weddings and Engagements'],article,News,Society
2020-02-09,"He proposed while fellow alumni from the Colgate 13, an all-male college a cappella group he once belonged to, sang backup.",['Weddings and Engagements'],article,News,Society
2020-02-09,The couple met during their residency in 2017 at the Massachusetts General Hospital.,['Weddings and Engagements'],article,News,Society
2020-02-09,"The couple met at Cornell, from which they graduated.",['Weddings and Engagements'],article,News,Society
2020-02-09,An acclaimed series airs its final season on Showtime. And a new series of New York vignettes is on HBO.,"['Television', 'Movies']",article,News,Culture
2020-02-09,"Hosted by RuPaul and featuring Justin Bieber as musical guest, this week’s show also had another memorable Oscar segment.",['Television'],article,News,Culture
2020-02-09,Ethiopia is staking its hopes on its $4.5 billion hydroelectric dam. Egypt fears it will cut into its water supplies. President Trump is mediating.,"['Water', 'Hydroelectric Power', 'Levees and Dams', 'United States International Relations']",multimedia,Interactive Feature,World
2020-02-09,"A ride downtown, waking up from a dream and more reader tales of New York City in this week’s Metropolitan Diary.",[],article,News,Metropolitan
2020-02-09,"The Knicks have brought in Steve Stoute, a longtime music executive who heads an ad agency, to change how fans — and N.B.A. free agents — perceive the team.","['Basketball', 'ADVERTISING AND MARKETING']",article,News,Sports
2020-02-09,Video cameras monitor the German philosopher’s grave in London after it was defaced twice last year — the latest vandalism in a tumultuous history.,"['Cemeteries', 'Vandalism', 'Politics and Government']",article,News,Foreign
2020-02-09,"In “Author in Chief,” Craig Fehrman examines the books that American presidents have written before and after they were in office.","['Writing and Writers', 'Books and Literature', 'Presidents and Presidency (US)', 'United States Politics and Government']",article,News,Books
2020-02-09,"It began online as an intricate, if baseless, pro-Trump conspiracy theory. Now it has surfaced in political campaigns, criminal cases and a college classroom.","['Fringe Groups and Movements', 'Rumors and Misinformation', 'United States Politics and Government', 'Social Media', 'News and News Media']",article,News,Investigative
2020-02-09,Recent residential sales in New York City and the region.,['Real Estate and Housing (Residential)'],article,News,RealEstate
2020-02-09,"The island has a long history of encouraging residents to identify as white, but there are growing efforts to raise awareness about racism.","['Race and Ethnicity', 'Census', 'Black People', 'Blacks', 'Discrimination']",article,News,National
2020-02-09,A lower-than-expected turnout for the caucuses has raised concerns that the grass-roots activism in the party may be waning after three years of battles with Washington.,"['Primaries and Caucuses', 'Presidential Election of 2020', 'United States Politics and Government']",article,News,Politics
