date,abstract,keywords,doc_type,material_type,news_desk
2020-02-21,The New York City Ballet principal Daniel Ulbricht’s solo in this Justin Peck ballet is all about momentum — and clarity.,['Dancing'],article,News,Culture
2020-02-21,"A day before the caucuses, the state party says volunteer and staff members at caucus sites are forbidden to talk to the news media.","['Primaries and Caucuses', 'Presidential Election of 2020', 'Mobile Applications', 'United States Politics and Government']",article,News,Politics
2020-02-21,"The actress, whose FX series returns on March 5, puts “All That Jazz,” A Tribe Called Quest and Norman Lear’s comedies on her list of must-haves.","['Television', 'ACTORS AND ACTRESSES']",article,News,Arts&Leisure
2020-02-21,"Manchester City’s fans are the most vociferous defenders of their club’s reputation. But that does not mean they are not victims, too.",['Soccer'],article,News,Sports
2020-02-21,Plus: When wedding crashing goes right.,"['Dating and Relationships', 'Marriages', 'Modern Love (Times Column)']",article,News,Styles
2020-02-21,"Handmade posters, reading “Authoritarian,” “Classist” and “Oligarch,” were plastered on the windows of a Bloomberg field office in Knoxville, Tenn.","['Presidential Election of 2020', 'Vandalism']",article,News,Politics
2020-02-21,"In the fifth season of AMC’s esteemed drama, Jimmy McGill completes his transformation into Saul Goodman and the show’s separate story lines also start to converge.",['Television'],article,News,Culture
2020-02-21,"He pushed conservative institutions to program the new, and was a noted conductor of major avant-garde works.","['Deaths (Obituaries)', 'Tanglewood Music Festival (Lenox, Mass)', 'Classical Music']",article,Obituary (Obit),Obits
2020-02-21,Adam Cohen’s “Supreme Inequality” shows that for 50 years the decisions of the Supreme Court have favored the wealthy.,"['Books and Literature', 'Income Inequality']",article,Review,BookReview
2020-02-21,Joe Biden has recounted a story — three times in two weeks — about being arrested on his way to see Nelson Mandela. He did not mention it in his memoir or speak prominently of it before.,"['Presidential Election of 2020', 'United States Politics and Government']",article,News,Politics
2020-02-21,"The judge told jurors to keep deliberating after they sent a note asking if they could be deadlocked on the top counts, but unanimous on others.","['Sex Crimes', 'Sexual Harassment', 'Jury System', '#MeToo Movement', 'Movies']",article,News,Metro
2020-02-21,"Also a record producer, he shaped London’s fertile club scene in the late 1980s and ’90s and helped meld rock and dance music.","['Deaths (Obituaries)', 'Pop and Rock Music', 'Disc Jockeys', 'Bars and Nightclubs']",article,Obituary (Obit),Obits
2020-02-21,"The chef, in the wake of the sexual harassment scandal at the Spotted Pig, has enlisted fellow cooks to celebrate the Breslin’s 10th anniversary.","['Restaurants', 'Chefs', 'Sexual Harassment']",article,News,Dining
2020-02-21,"In its final U.S. appearance, the company displayed its virtues: luxuriant dancing allied to courtly music.","['Dancing', 'Shutdowns (Institutional)']",article,Review,Culture
2020-02-21,See the looks from the Versace: Fall 2020 Collection.,['Milan Fashion Week'],multimedia,Slideshow,Fashion & Style
2020-02-21,The museum has released emails about its decision to blur some signs in a photo of the 2017 Women’s March that were critical of President Trump.,"['Archives and Records', 'United States Politics and Government', 'Museums', 'Demonstrations, Protests and Riots']",article,News,Express
2020-02-21,"O’Neal, Bryant’s former teammate, says he has some regrets. His former coach Del Harris, 82, is struck by the death of a man half his age who was early in his retirement.","['Basketball', 'Funerals and Memorials']",article,News,Sports
2020-02-21,"In questions before a grand jury, prosecutors have focused on whether a top pilot misled regulators about new flight control software in the 737 Max plane.","['Boeing 737 Max Groundings and Safety Concerns (2019)', 'Aviation Accidents, Safety and Disasters', 'Pilots', 'Regulation and Deregulation of Industry']",article,News,Business
2020-02-21,Promoters and networks cooperate for a bout they hope will transcend boxing.,['Boxing'],article,News,Sports
2020-02-21,"After protracted negotiations with Buckingham Palace, the couple agreed not to use the word “royal” in their philanthropic and commercial activities.",['Royal Families'],article,News,Foreign
2020-02-21,The bank reached a settlement with federal prosecutors and the Securities and Exchange Commission after abusing customers.,"['Frauds and Swindling', 'Fines (Penalties)', 'Banking and Financial Institutions', 'Regulation and Deregulation of Industry', 'Securities and Commodities Violations', 'Consumer Protection']",article,News,Business
2020-02-21,The new acting director of national intelligence also asked to see the facts underlying the finding that Russia is interfering in the 2020 election and favors President Trump’s re-election.,"['Russian Interference in 2016 US Elections and Ties to Trump Associates', 'United States Politics and Government', 'Presidential Election of 2020', 'Trump-Ukraine Whistle-blower Complaint and Impeachment Inquiry', 'Classified Information and State Secrets', 'Espionage and Intelligence Services', 'Rumors and Misinformation']",article,News,Washington
2020-02-21,"Amanda Eyre Ward’s new novel, “The Jetsetters,” follows a dysfunctional family out to sea.",['Books and Literature'],article,Review,BookReview
2020-02-21,"The most important thing is not that you were first to accomplish something, but that you did so on your own terms, with as few compromises as possible.",['Fashion and Apparel'],article,News,TStyle
2020-02-21,"At her New York City office, the designer shows T a selection of her treasured talismans.",['Fashion and Apparel'],multimedia,Video,
2020-02-21,"“Their power is in the energy of the person who gives them to you,” says the fashion designer.","['Crystals', 'Fashion and Apparel']",article,News,TStyle
2020-02-21,"A long-running dispute over a pipeline in British Columbia has turned into a national political storm, caused layoffs in the rail industry and raised broader economic fears.","['Politics and Government', 'Demonstrations, Protests and Riots', 'Indigenous People']",article,News,Foreign
2020-02-21,"Bernie Sanders is expected to do well in the Nevada caucuses, and the race for second place is wide open. See how important Nevada is to the Democrats competing there today.","['Presidential Election of 2020', 'Primaries and Caucuses']",multimedia,Interactive Feature,U.S.
2020-02-21,The nominal Democratic front-runner denounced Russia’s efforts to attack American democracy.,"['Presidential Election of 2020', 'Cyberwarfare and Defense', 'Espionage and Intelligence Services', 'Russian Interference in 2016 US Elections and Ties to Trump Associates', 'United States Politics and Government', 'Primaries and Caucuses']",article,News,Washington
2020-02-21,Answering your questions about our series on online child abuse.,"['Podcasts', 'Newsletters']",article,News,Podcasts
2020-02-21,"The disruption of China’s manufacturing network, and slowdown of its economy, have rippled through to airlines, automakers, tech companies and more.","['Coronavirus (2019-nCoV)', 'Economic Conditions and Trends', 'Factories and Manufacturing', 'Interest Rates', 'Stocks and Bonds', 'Shutdowns (Institutional)', 'AIRLINES AND AIRPLANES', 'Automobiles']",article,News,Business
2020-02-21,"President Trump’s fourth national security adviser says he is restoring a neutral “process,” but the president’s tweets come first.","['United States International Relations', 'United States Politics and Government']",article,News,Washington
2020-02-21,One of pop’s biggest stars returns with an album that has unexpected kinship with new music from Harry Styles and Selena Gomez.,"['Pop and Rock Music', 'RHYTHM AND BLUES (MUSIC)']",article,News,Culture
2020-02-21,The fashion designer enjoys some downtime leading up to his fall 2020 show.,"['New York Fashion Week', 'Fashion and Apparel']",multimedia,Video,
2020-02-21,"Amid preparations for his fall 2020 show, the designer managed to carve out a bit of downtime.","['Procrastination', 'Fashion and Apparel', 'New York Fashion Week']",article,News,TStyle
2020-02-21,"The special will be available to subscribers at the debut of the new streaming service, in May. (Could you BE any more excited?)","['Television', 'Video Recordings, Downloads and Streaming']",article,News,Express
2020-02-21,Here’s what you need to know at the end of the day.,[],article,briefing,NYTNow
2020-02-21,A tantalizing question sent to the trial judge left many people wondering if the jurors were nearing a conviction.,"['Sex Crimes', 'Jury System', '#MeToo Movement']",article,News,Metro
2020-02-21,"He produced programs, like “Inside Bedford-Stuyvesant” and “Like It Is,” that exposed a wide audience to the black experience.","['Deaths (Obituaries)', 'Black People', 'Blacks', 'Television']",article,Obituary (Obit),Obits
2020-02-21,Extravagant tableaus of fruits and flowers have become popular centerpieces for runway shows and photo shoots — and call for a new kind of responsible clean up.,"['Waste Materials and Disposal', 'Food', 'Recycling of Waste Materials']",article,News,TStyle
2020-02-21,"Adam Cohen talks about “Supreme Inequality,” and Madeline Levine discusses “Ready or Not.”",['Books and Literature'],article,News,Books
2020-02-21,"The Auschwitz Memorial said the show’s human chess scene at a concentration camp was a dangerous caricature, and called for the removal of an anti-Semitic children’s book.","['Holocaust and the Nazi Era', 'Books and Literature', 'E-Commerce', 'ANTI-SEMITISM']",article,News,Express
2020-02-21,"Acquiring Gerrit Cole and keeping J.A. Happ may mean the Yankees incur steep luxury tax penalties, but they’re erring on the side of caution after last year’s nightmarish rash of injuries.","['Baseball', 'Sports Injuries', 'Fines (Penalties)']",article,News,Sports
2020-02-21,Mr. Christian killed two men who had intervened to confront him as he went on an anti-Muslim tirade against two black teenagers.,"['Murders, Attempted Murders and Homicides', 'Fringe Groups and Movements', 'Muslim Americans', 'Discrimination', 'Freedom of Speech and Expression', 'Race and Ethnicity', 'Hate Crimes']",article,News,National
2020-02-22,"Under Prime Minister Narendra Modi, India is the American president’s spiritual home: an inferno of systemic cruelty.","['United States International Relations', 'Politics and Government', 'Economic Conditions and Trends', 'Indian-Americans', 'United States Politics and Government', 'Caste Systems', 'Income Inequality']",article,Op-Ed,OpEd
2020-02-22,The administration’s plan to divert more military funds to building a border wall is the latest example of the long-running erosion of Congress’s power of the purse.,"['Federal Budget (US)', 'United States Politics and Government', 'Earmarks (Finance)', 'Politics and Government', 'Border Barriers']",article,News,Washington
2020-02-22,"He incurred the wrath of the dictator Augusto Pinochet, was exiled, and became an expert in how to heal traumatized countries.","['Deaths (Obituaries)', 'Legal Profession', 'Human Rights and Human Rights Violations']",article,Obituary (Obit),Obits
2020-02-22,The state’s voters said 1.4 million ex-felons should be allowed to vote. It’s now up to the courts to protect their rights.,"['Ex-Convicts', 'Presidential Election of 2020', 'Voter Registration and Requirements', 'Referendums', 'Constitutional Amendments']",article,Op-Ed,Editorial
2020-02-22,The party’s riskiest bet is now its likeliest.,"['Presidential Election of 2020', 'Primaries and Caucuses', 'United States Politics and Government']",article,Op-Ed,OpEd
2020-02-22,"Cheers, selfies and bagpipers as Andy Byford departs as the leader of the city’s subway.",[],article,News,Metro
2020-02-22,"The Mets hope the two-time All-Star outfielder, sidelined by injuries since 2018, can return to form.","['Baseball', 'Sports Injuries']",article,News,Sports
2020-02-22,What happens when intelligence officials warn that Russia is meddling in American politics again? Donald Trump gets mad — at the intelligence officials.,"['Espionage and Intelligence Services', 'Russian Interference in 2016 US Elections and Ties to Trump Associates', 'Presidential Election of 2020', 'Cyberwarfare and Defense', 'United States Politics and Government']",article,Editorial,Editorial
2020-02-22,"Privatization has ushered in mold, mismanagement and worse.","['Military Bases and Installations', 'Real Estate and Housing (Residential)', 'United States Defense and Military Forces', 'United States Politics and Government', 'Privatization', 'Defense Contracts']",article,Op-Ed,OpEd
2020-02-22,The authors of “Rage Baking” started a different conversation than they intended.,"['Cooking and Cookbooks', 'Women and Girls', 'Black People', 'Blacks']",article,News,Dining
2020-02-22,"The vote was 5 to 4, with the Supreme Court’s conservatives in the majority.","['Decisions and Verdicts', 'Green Cards (US)', 'Welfare (US)', 'Immigration and Emigration', 'United States Politics and Government']",article,News,Washington
2020-02-22,"Trenton Charlson’s back, at his zenith, with a quality puzzle.","['Crossword Puzzles', 'Butterflies and Moths']",article,News,Games
2020-02-22,"The company had asked a court for limits on consultants working with the attorney general of Texas, who is leading a multistate investigation.","['Computers and the Internet', 'Antitrust Laws and Competition Issues', 'Attorneys General', 'Search Engines']",article,News,Business
2020-02-22,"Corrections that appeared in print on Saturday, Feb. 22, 2020.",[],article,Correction,Corrections
2020-02-22,"After admiring each other from afar for weeks, Mackenzie Jacks and William Frantz, who lived in neighboring apartment buildings, finally got a chance to meet, thanks to a thrill-seeking stranger.",['Weddings and Engagements'],article,News,Styles
2020-02-22,"In total, 28 countries outside of China have reported more than 1,500 coronavirus cases.",['Coronavirus (2019-nCoV)'],article,News,Foreign
2020-02-22,"Watch a raw comedy special on HBO, or tune into the 51st N.A.A.C.P. Awards on BET.","['Movies', 'Television']",article,News,Culture
2020-02-22,"Aleksandra Shelton, a four-time Olympic fencer, grew frustrated by what she considered age and gender discrimination. But when she sought to compete for the United States, Polish officials stood in her way.","['Fencing (Sport)', 'Women and Girls', 'Olympic Games (2020)', 'Discrimination', 'Age, Chronological']",article,News,Sports
2020-02-22,"Burnley has invested the bulk of its Premier League riches in facilities instead of players, believing that approach is its best bet to avoid relegation. Not every club follows the same plan.",['Soccer'],article,News,Sports
2020-02-22,"The National Domestic Workers Alliance is putting nannies, housekeepers and home care workers at the center of the labor and progressive political movement.",['Domestic Service'],article,News,Politics
2020-02-22,"To understand how union members in Las Vegas are thinking about Bernie Sanders, it helps to remember a picket line in the 1990s.","['Presidential Election of 2020', 'Health Insurance and Managed Care', 'Organized Labor', 'Strikes']",article,News,Politics
2020-02-22,"Captured on video, the unique culture of the colorful corner stores is winning fans around the world.","['Social Media', 'Convenience Stores', 'Customer Relations', 'Video Recordings, Downloads and Streaming']",article,News,Metro
2020-02-22,"Activists came close in 2018. This year, President Alberto Fernández is on their side and is expected to present a legalization bill to Congress.","['Law and Legislation', 'ABORTION', 'Politics and Government', 'Human Rights and Human Rights Violations', 'Demonstrations, Protests and Riots']",article,News,Foreign
2020-02-22,"Quotation of the Day for Saturday, February 22, 2020.",[],article,News,Summary
2020-02-22,The Democratic candidates ripped into one another — and especially Michael Bloomberg — as the Nevada caucuses approached.,"['Presidential Election of 2020', 'Debates (Political)', 'Primaries and Caucuses']",article,News,Politics
2020-02-22,Bernie Sanders says winning a plurality of delegates is good enough for the nomination. His rivals say a majority is needed. What does that mean? And why are superdelegates coming up again?,"['Presidential Election of 2020', 'Democratic National Convention', 'Primaries and Caucuses']",article,News,Politics
2020-02-22,Every leading candidate for the 2020 Democratic nomination is proposing trillions of dollars of new taxes on wealthy Americans and businesses. The divide in the field is how high to go.,"['Federal Taxes (US)', 'Presidential Election of 2020', 'High Net Worth Individuals', 'Income Tax', 'United States Politics and Government', 'Inheritance and Estate Taxes', 'Capital Gains Tax', 'Payroll Tax', 'Health Insurance and Managed Care']",article,News,Politics
2020-02-22,The Vermont senator has long brushed off political vulnerabilities and evaded attacks from rivals. But the spotlight on his front-runner status and possible Russian interference could pose challenges.,"['Presidential Election of 2020', 'Primaries and Caucuses', 'Voting and Voters', 'Polls and Public Opinion', 'Political Advertising']",article,News,Politics
2020-02-22,Chris Appleton did J. Lo’s hair for the Super Bowl. The video went a bit crazy.,"['Hair', 'Football', 'Super Bowl', 'Social Media', 'Celebrities']",article,News,Styles
2020-02-22,"From chic bed-and-breakfasts to sprawling modern luxuries, these hotels are notable bright spots in a city filled with stars.","['Travel and Vacations', 'Hotels and Travel Lodgings', 'Interior Design and Furnishings', 'Design', 'ARCHITECTURE']",article,News,Travel
2020-02-22,"On an island in the Philippines, waterlogged for one-third of every year, residents adjust to their sodden existence instead of fleeing.","['Global Warming', 'Floods', 'Islands', 'Coast Erosion']",article,News,Foreign
2020-02-22,More than three days passed before Japan imposed a quarantine. That delay and other missteps helped produce the largest outbreak of the virus beyond China.,"['Quarantines', 'Cruises', 'Coronavirus (2019-nCoV)', 'Epidemics', 'Protective Clothing and Gear', 'Politics and Government']",article,News,Foreign
2020-02-22,Volunteers use different colors of yarn to make “temperature scarves” that serve as fashionable records of a warming world.,"['Wool and Woolen Goods', 'Knitting and Knit Goods', 'Scarves', 'Global Warming', 'National Parks, Monuments and Seashores']",article,News,Express
2020-02-22,Short videos are everywhere now. The founder of Byte hopes people are nostalgic for the original six-second video app.,"['Video Recordings, Downloads and Streaming', 'Mobile Applications']",article,News,Styles
2020-02-22,See the looks from the Salvatore Ferragamo: Fall 2020 Collection.,"['Fashion and Apparel', 'Milan Fashion Week']",multimedia,Slideshow,Fashion & Style
2020-02-22,"“It’s an American tragedy,” said a pastor whose congregants have been disappearing for years, heading to cities throughout the Midwest and the South.",['Race and Ethnicity'],article,News,National
2020-02-22,"If you’re like me, vacation planning also means “where am I going to run?” planning.","['Running', 'Road Trips', 'Parks and Other Recreation Areas', 'Travel and Vacations', 'National Parks, Monuments and Seashores']",article,News,Well
2020-02-22,"When the Trump administration rolled out its policy to force asylum seekers to wait in Mexico, officials said medical exemptions would help the sick. They haven’t.","['Emergency Medical Treatment', 'Immigration and Emigration', 'Asylum, Right of', 'United States Politics and Government']",article,News,Washington
2020-02-22,"The Berkshire Hathaway chief noted the steady money making of the conglomerate, but gave no insight into succession or other hot topics.",[],article,News,Business
2020-02-22,"When cantankerous neighbors make life miserable, it can veer into harassment. There are ways to defend yourself.","['Real Estate and Housing (Residential)', 'Cooperatives', 'Boards of Directors']",article,News,RealEstate
2020-02-22,"Pierre Franey’s turkey chili, a gumbo version from Sam Sifton, vegetarian options and more.","['Chili (Food)', 'Recipes']",article,News,Dining
2020-02-22,"Local health departments around the United States are scrambling to monitor thousands of people returning from travel in China and elsewhere. Among the tasks: daily calls, emails, texts.","['Coronavirus (2019-nCoV)', 'Quarantines', 'Epidemics', 'Tests (Medical)']",article,News,National
2020-02-22,"A cease-fire is needed as Mr. Assad, with Russian help, attacks the last desperate refugees.","['Refugees and Displaced Persons', 'United States International Relations']",article,Editorial,Editorial
2020-02-22,"She had a long career onstage and on film and TV. But she found her greatest fame late in life, as a stern housekeeper on a hit HBO series.","['Deaths (Obituaries)', 'Television', 'Theater', 'ACTORS AND ACTRESSES']",article,Obituary (Obit),Obits
2020-02-22,Will Shortz takes a spin in the constructor’s seat.,['Crossword Puzzles'],article,News,Games
2020-02-22,We selected seven of our favorites from among the 200-plus entries in this year’s student letter-writing competition.,"['Education (Secondary)', 'Letters', 'Teenagers and Adolescence']",article,Letter,Letters
2020-02-22,"Before he was arrested this month, the former head of Pemex lay low in one of the world’s most discreet and exclusive locations on Spain’s sunny southern coast.","['Fugitives', 'High Net Worth Individuals', 'Extradition', 'Oil (Petroleum) and Gasoline', 'Real Estate and Housing (Residential)']",article,News,Foreign
2020-02-22,See the looks from the Bottega Veneta: Fall 2020 Collection.,['Milan Fashion Week'],multimedia,Slideshow,Fashion & Style
2020-02-22,The price of ice hockey is forcing many parents to choose different sports for their boys.,"['Hockey, Ice']",article,News,Sports
2020-02-22,"When baseball’s commissioner decided not to punish the players involved in a sign-stealing scandal, he brought the wrath of rival teams and fans down on himself.","['Baseball', 'Cheating']",article,News,Sports
2020-02-22,Democrats had two days between their debate on Wednesday and the Nevada caucuses on Saturday to make a final pitch to voters. See the campaign in photos.,"['Presidential Election of 2020', 'Primaries and Caucuses', 'Photography']",multimedia,Interactive Feature,U.S.
2020-02-22,Detailed results and maps from the Nevada caucuses.,"['Primaries and Caucuses', 'Presidential Election of 2020', 'Elections']",multimedia,Interactive Feature,U.S.
2020-02-22,Follow live coverage and analysis from Times reporters.,"['Elections', 'Presidential Election of 2020', 'Primaries and Caucuses']",multimedia,Interactive Feature,U.S.
2020-02-22,"As senior officials are shown the door, a new personnel chief orders a search for political appointees as well as career officials deemed insufficiently supportive of the president.","['United States Politics and Government', 'Appointments and Executive Changes', 'Government Employees']",article,News,Washington
2020-02-22,His campaign is testing the boundaries of what platforms like Twitter and Facebook allow in politics. They’re having trouble coming up with an answer.,"['Social Media', 'Political Advertising', 'Presidential Election of 2020', 'United States Politics and Government']",article,News,Business
2020-02-22,"Frankly, Trump doesn’t give a damn.","['United States Politics and Government', 'Espionage and Intelligence Services', 'Movies']",article,Op-Ed,OpEd
2020-02-22,"European finance ministers, meeting at the G20 in Riyadh, are pushing the United States for a global tax deal as a year-end deadline looms.","['Computers and the Internet', 'Corporate Taxes', 'Economic Conditions and Trends', 'International Trade and World Market', 'Customs (Tariff)', 'United States International Relations']",article,News,National
2020-02-22,China’s failures on the coronavirus are distracting us from the mess we have at home.,"['United States Politics and Government', 'Health Insurance and Managed Care', 'Teeth and Dentistry', 'Coronavirus (2019-nCoV)', 'Medicaid', 'Medicare', 'Deaths (Fatalities)']",article,Op-Ed,OpEd
2020-02-22,"If the young teens accused in Tessa Majors’s murder are convicted, a 1978 law could deny them a chance at redemption.","['Murders, Attempted Murders and Homicides', 'Juvenile Delinquency', 'Criminal Justice', 'Mandatory Sentencing', 'Prisons and Prisoners']",article,Editorial,Editorial
2020-02-22,Some lessons from NeverTrump for PleaseNotBernie.,"['Presidential Election of 2020', 'United States Politics and Government', 'Primaries and Caucuses', 'Voting and Voters', 'Conservatism (US Politics)']",article,Op-Ed,OpEd
2020-02-22,See the looks from the Missoni: Fall 2020 Collection.,['Milan Fashion Week'],multimedia,Slideshow,Fashion & Style
2020-02-22,"In a city where street life happens largely in cars, residents speak of their loss through art and graffiti in public places.","['Graffiti', 'Murals', 'Basketball']",article,News,National
2020-02-22,The bus company announced the policy change only days after a leaked memo revealed that agents could not board without consent.,['Immigration and Emigration'],article,News,Express
